event_name,details,date,start_time,end_time,location,ticket_type,ticket_price,available_tickets,organizer_name,organizer_email
Tech Conference ,"Join industry leaders and innovators at the Tech Conference in New York, where cutting-edge technologies and forward-thinking ideas converge to shape the future. Held at the iconic New York Convention Center, this event offers invaluable networking opportunities, inspiring talks, and the latest tech advancements.",10-11-2024,10:00 AM,4:00 PM,New York Convention Center,Early Bird,10,200,Alice Johnson,alice@gmail.com
Music Festival,"Experience an unforgettable weekend at the Music Festival, hosted at the renowned Los Angeles Stadium. Join music lovers from around the world for live performances, incredible artists, and an electrifying atmosphere in the heart of LA.",05-12-2024,5:00 PM,10:00 PM,Los Angeles Stadium,VIP,120,50,Bob Smith,bob@gmail.com
Startup Summit ,"Connect with visionary entrepreneurs and investors at the Startup Summit in San Francisco. Held at the iconic Conference Hall, this event is designed to inspire, innovate, and ignite growth in the startup community.",22-02-2025,9:00 AM,3:00 PM,San Francisco Conference Hall,General,75,300,Charlie Davis,charlie@gmail.com
Art Expo ,"Immerse yourself in a world of creativity at the Art Expo, held at the Chicago Art Center. Discover inspiring artworks, connect with artists, and celebrate the beauty of contemporary and classic art.",20-03-2025,1:00 PM,6:00 PM,Chicago Art Center,VIP,60,80,David Adams,david@gmail.com
Gaming Expo,"Step into the ultimate gaming experience at the Gaming Expo in Seattle. Join fellow gamers, explore the latest in gaming technology, and compete in exciting tournaments at the Seattle Gaming Arena.",15-01-2025,12:00 PM,6:00 PM,Seattle Gaming Arena,General,40,700,Eve Thompson,eve@gmail.com
Book Fair,"Discover a world of literature at the Book Fair in Boston Library. Connect with authors, browse a wide selection of books, and immerse yourself in stories from every genre.",10-07-2025,11:00 AM,5:00 PM,Boston Library,Student,15,400,Frank White,frank@gmail.com
Sports Championship,Cheer on your favorite teams at the thrilling Sports Championship in Miami Sports Stadium. Witness top athletes compete for glory in an unforgettable showcase of skill and sportsmanship.,30-12-2024,2:00 PM,8:00 PM,Miami Sports Stadium,General ,50,1000,Grace Lee,grace@gmail.com
Fashion Show ,"Step into the world of glamour at the Fashion Show in Las Vegas Fashion Arena. Witness stunning collections, trendsetting designs, and the latest in couture on the runway.",20-05-2025,7:00 PM,11:00 PM,Las Vegas Fashion Arena,VIP,200,0,Henry Brown,henry@gmail.com
Culinary Expo ,"Indulge in a feast of flavors at the Culinary Expo in Houston. Explore gourmet creations, culinary innovations, and taste dishes from renowned chefs at the Houston Culinary Center.",25-04-2025,4:00 PM,8:00 PM,Houston Culinary Center,General ,30,500,Ivy Clark,ivy@gmail.com
Car Expo,"Rev up for the Car Expo at Detroit Auto Arena! Discover the latest models, cutting-edge technology, and iconic designs in the heart of America’s automotive capital.",18-11-2024,10:00 AM,4:00 PM,Detroit Auto Arena,VIP,80,600,Jack Wilson,jack@gmail.com
Tech Meetup ,"Connect with tech enthusiasts, innovators, and industry leaders at the Tech Meetup in Silicon Valley. Engage in discussions, explore new trends, and grow your network at the heart of tech innovation.",10-02-2025,9:00 AM,2:00 PM,Silicon Valley Tech Hub,Early Bird,20,300,Kathy Green,kathy@gmail.com
Entrepreneur Workshop,"Empower your entrepreneurial journey at the Entrepreneur Workshop in Dallas. Learn from successful founders, gain insights into startup strategies, and connect with like-minded individuals ready to make an impact.",03-11-2024,11:00 AM,4:00 PM,Dallas Business Center,Student,40,200,Liam Scott,liam@gmail.com
Startup Pitch ,"Showcase your startup ideas at the Startup Pitch event in Los Angeles. Gain feedback from investors, connect with industry experts, and take your vision to the next level at the vibrant Startup Arena.",12-01-2025,3:00 PM,6:00 PM,Los Angeles Startup Arena,VIP,100,0,Mia Collins,mia@gmail.com
Wellness Fair ,"Embrace a holistic approach to health at the Wellness Fair in San Diego. Explore wellness products, attend informative sessions, and connect with experts dedicated to your well-being.",20-11-2024,1:00 PM,5:00 PM,San Diego Wellness Center,General ,25,500,Noah Turner,noah@gmail.com
Fitness Expo,"Get inspired to achieve your fitness goals at the Fitness Expo in Austin. Discover the latest in workout gear, meet fitness experts, and join sessions designed to elevate your health and wellness journey.",25-10-2024,12:00 PM,6:00 PM,Austin Fitness Center,General ,30,300,Olivia Harris,olivia@gmail.com
